OBJECTIVE: The aim of this study was to test the hypothesis that greater global and situational relationship satisfaction would reduce the negative impact of threatening information on acute pain.,0
DESIGN: An experimental design was used to manipulate threat and elicit acute pain via a cold pressor task.,1
SETTING: The study was completed in a research laboratory at a large urban university in the Midwestern USA.,0
SUBJECTS: Participants were 134 couples in which at least one individual was an undergraduate student.,0
METHODS: After administration of a global relationship satisfaction measure couples were randomly assigned to either receive high or low threatening information about the painful task.,0
Following the threat manipulation couples discussed the upcoming task and rated their satisfaction with the interaction (i.e. situational relationship satisfaction).,0
The designated pain participant then completed the painful task alone.,0
RESULTS: The threat manipulation altered couples' perceived threat of pain.,0
Situational relationship satisfaction moderated the effect of threat on pain trajectories such that situational relationship satisfaction predicted less pain intensity at an earlier point in the task for the low threat condition than the high threat condition.,0
Greater global relationship satisfaction predicted greater likelihood of task completion among those in the low threat condition whereas it was unrelated to task completion in the high threat condition.,0
Greater global relationship satisfaction also predicted lower pain intensity throughout the task.,0
CONCLUSIONS: These findings demonstrate that the interpersonal context is independently related to acute pain and may also alter the effect of threatening information on acute pain.,1
Chronically elevated HPA activity has often been associated with fear and anxiety but there is evidence that single administrations of glucocorticoids may acutely reduce fear.,1
Moreover peri-traumatic cortisol elevation may protect against development of post-traumatic stress disorder.,0
Hypervigilant processing of threat information plays a role in anxiety disorders and although relations with HPA functioning have been established causality of these relations remains unclear.,1
Presently self-reported anxiety and response time patterns on a masked emotional Stroop task with fearful faces were measured in 20 healthy young men after double-blind placebo-controlled oral administration of 40 mg cortisol.,1
The masked fearful Stroop task measures vocal colornaming response latencies for pictures of neutral and fearful faces presented below the threshold for conscious perception.,0
Results showed increased response times on trials for fearful compared to neutral faces after placebo but this emotional Stroop effect was acutely abolished by cortisol administration.,0
This effect was most pronounced in subjects with heightened anxiety levels.,0
This is the first evidence showing that exogenous cortisol acutely reduces anxiety-driven selective attention to threat.,0
These results extend earlier findings of acute fear reduction after glucocorticoid administration.,1
This suggests interactions of HPA functioning and vigilant attention in the pathogenesis of anxiety disorders.,0
Possible neuroendocrine mechanisms of action are discussed.,0
The use of fear conditioning and extinction paradigms to examine intermediate phenotypes of anxiety and stress-related disorders has facilitated the identification of neurobiological mechanisms that underlie specific components of abnormal psychological functioning.,0
Across species acute pharmacologic manipulation of the endogenous cannabinoid system has provided evidence of its critical role in fear extinction but the effects of chronic cannabis on extinction are relatively understudied.,0
In rats chronic cannabinoid administration impairs fear extinction in a drug-free state.,1
Here we examine whether chronic cannabis use is associated with impaired fear extinction in humans.,1
Participants were healthy chronic cannabis users (n = 20) and nonuser controls with minimal lifetime cannabis use (n = 20) matched on age sex and race who all screened negative for psychiatric disorders.,0
A 2-day differential fear conditioning paradigm was used to test the hypothesis that chronic cannabis use would be associated with impaired extinction of the skin conductance response.,1
Consistent with hypotheses chronic cannabis use was associated with reduced within-session extinction of skin conductance response on Day 1 (d = 0.78) and between-session extinction on Day 2 (d = 0.76).,0
Unexpectedly cannabis use was also associated with reduced subjective differentiation between threat and safety stimuli during conditioning.,0
Replication and translation of findings are necessary to test potential mechanisms directly and examine whether impairments can be reversed pharmacologically or after a period of cannabis abstinence.,0
(PsycINFO Database Record,0
RATIONALE: In this study we used functional magnetic resonance imaging (fMRI) to examine the effects of acute tryptophan depletion (ATD) a well-recognised method for inducing transient cerebral serotonin depletion on brain activation to fearful faces.,1
OBJECTIVES: We predicted that ATD would increase the responsiveness of the amygdala to fearful faces as a function of individual variation in threat sensitivity.,1
METHODS: Twelve healthy male volunteers received a tryptophan depleting drink or a tryptophan balancing amino acid drink (placebo) in a double-blind crossover design.,0
Five hours after drink ingestion participants were scanned whilst viewing fearful happy and neutral faces.,0
RESULTS: Consistent with previous findings fearful faces induced significant signal change in the bilateral amygdala/hippocampus as well as the fusiform face area and the right dorsolateral prefrontal cortex.,1
Furthermore ATD modulated amygdala/hippocampus activation in response to fearful relative to happy faces as a function of self-reported threat sensitivity (as measured with the Behavioral Inhibition Scale; Carver CS White TL (1994) Behavioral inhibition behavioral activation and affective responses to impending reward and punishment: the BIS/BAS scales.,0
J Pers Soc Psychol 67:319-333).,0
CONCLUSION: The data support the hypothesis that individual variation in threat sensitivity interacts with manipulation of 5-HT function to bias the processing of amygdala-dependent threat-relevant stimuli.,1
Fear promotes adaptive responses to threats.,1
However when the level of fear is not proportional to the level of threat maladaptive fear-related behaviors characteristic of anxiety disorders result.,1
Post-traumatic stress disorder develops in response to a traumatic event and patients often show sensitized reactions to mild stressors associated with the trauma.,0
Stress-enhanced fear learning (SEFL) is a rodent model of this sensitized responding in which exposure to a 15-shock stressor nonassociatively enhances subsequent fear conditioning training with only a single trial.,1
We examined the role of corticosterone (CORT) in SEFL.,1
Administration of the CORT synthesis blocker metyrapone prior to the stressor but not at time points after attenuated SEFL.,0
Moreover CORT co-administered with metyrapone rescued SEFL.,0
However CORT alone without the stressor was not sufficient to produce SEFL.,0
In these same animals we then looked for correlates of SEFL in terms of changes in excitatory receptor expression.,0
Western blot analysis of the basolateral amygdala (BLA) revealed an increase in the GluA1 AMPA receptor subunit that correlated with SEFL.,1
Thus CORT is permissive to trauma-induced changes in BLA function.,0
Acute pain informs the individual that there is an imminent threat of body damage and is associated with the urge to escape and avoid.,0
Fear learning takes place when neutral stimuli receive the propensity to predict the occurrence of pain and when defensive responses are initiated in anticipation of potential threats to the integrity of the body.,1
Fear-avoidance models have been put forward featuring the role of individual differences in catastrophic interpretations of pain in the modulation of learning and avoidance.,0
Based on extensive literature on fear reduction in anxiety disorders; cognitive-behavioral treatments have been developed and applied to patients with chronic pain reporting substantial pain-related fear.,1
In this article we discuss mechanisms underlying the acquisition the assessment and extinction of pain-related fear through the cognitive-behavioral treatment of pain-related fear.,1
Finally we provide a number of critical notes and directions for future research in the field of chronic pain and pain-related fear.,0
