Apart from such visible outcome however behaviorally relevant information can also be obtained when analyzing the animals' ultrasonic vocalization which is typically emitted in highly motivational situations like 22-kHz calls in response to acute or conditioned threat.,1
To further investigate such vocalizations and their relationship with overt behavior we tested male Wistar rats in a paradigm of Pavlovian fear conditioning where a tone stimulus (CS) was preceding an aversive foot-shock (US) in a distinct environment.,0
Importantly the shock dose was varied between groups (0-1.1 mA) and its acute and conditioned outcome were determined.,0
The analysis of visible behavior confirms the usefulness of immobility as a measure of fear conditioning especially when higher shock doses were used.,1
Rearing and grooming on the other hand were more useful to detect conditioned effects with lower shock levels.,0
Ultrasonic vocalization occurred less consistently than changes in overt behavior; however dose-response relationships were also observed during the phase of conditioning for example in latency call rate and lengths intervals between calls and sound amplitude.,0
Furthermore total calling time (and rate) were highly correlated with overt behavior namely behavioral inhibition as measured through immobility.,0
These correlations were observed during the phase of fear conditioning and the subsequent tests.,0
Importantly conditioned effects in overt behavior were observed both to the context and to the CS presented in this context whereas conditioned vocalization to the context was not observed (except for one rat).,0
In support and extent of previous results the present data show that a detailed analysis of ultrasonic vocalization can substantially broaden and refine the spectrum of analysis in behavioral work with rats since it can provide information about situational- state- and subject-dependent factors which are partly distinct from what is visible to the experimenter.,0
Social fearfulness is expressed on a continuum of severity from moderate distress to incapacitating fear.,1
The present article focuses on the brain states associated with this broad dimension of social anxiety in humans.,0
In total 70 published studies are summarized documenting the neural correlates of social anxiety during states of rest threat-related cognitive-affective activation and acute symptom provocation.,0
Neural exaggeration in limbic (amygdala) and paralimbic (insula) regions appears to be associated with functional outcomes involving increased attention for and processing of social threat.,1
Evidence is also reviewed showing that social anxiety is characterized by atypical functional connectivity in certain brain networks.,0
Despite a higher prevalence of social anxiety disorder among females males have been overrepresented in the published clinical studies (constituting approximately 56% of the total participants).,0
We evaluate the prospects of nonhuman animal models of social anxiety and discuss several promising directions for future research.,0
The review highlights the need to adopt an integrative network-based approach to the study of the neural substrates underlying social anxiety.,0
Exposure to a deadly threat an adult male rat induced the release of corticosterone in 14-day-old rat pups.,1
The endocrine stress response was decreased when the pups were reunited with their mother immediately after exposure.,1
These findings demonstrate that social variables can reduce the consequences of an aversive experience.,0
Recent findings obtained in patients with phobias or trauma-related anxiety disorders raise doubts concerning the interrelation between acute fear relief during an exposure-based therapeutic session and beneficial treatment progress.,0
In a mouse model explicit for exposure therapy we challenge the view that within-session fear reduction is the turning point for relearning of a stimulus-threat association.,1
Even though within-session extinction of auditory-cued fear memory was identical for prolonged and spaced tone presentations only the latter caused between-session extinction.,0
Furthermore spaced tone presentations led to between-session extinction even in the complete absence of within-session extinction as observed for remote fear memories and in case of abolished cannabinoid receptor type 1 signaling.,1
Induction of between-session extinction was accompanied by an increase in the number of c-Fos-positive neurons within the basolateral amygdala the cingulate cortex and the dentate gyrus independent of the level of within-session extinction.,1
Together our findings demonstrate that within-session extinction is neither sufficient nor essential for between-session extinction thus calling for a reconsideration of current concepts underlying exposure-based therapies.,0
Psychophysiological measures of fear expression provide observable intermediate phenotypes of fear-related symptoms.,0
Research Domain Criteria (RDoC) advocate using neurobiological intermediate phenotypes that provide dimensional correlates of psychopathology.,0
Negative Valence Systems in the RDoC matrix include the construct of acute threat which can be measured on a physiological level using potentiation of the acoustic startle reflex assessed via electromyography recordings of the orbicularis oculi muscle.,1
Impairments in extinction of fear-potentiated startle due to high levels of fear (termed fear load) during the early phases of extinction have been observed in posttraumatic stress disorder (PTSD).,0
The goals of the current work were to examine dimensional associations between fear-related symptoms of PTSD and fear load variables to test their validity as an intermediate phenotype.,1
We examined extinction of fear-potentiated startle in a cohort (n=269) of individuals with a broad range of civilian trauma exposure (range 0-13 traumatic events per person mean=3.5).,0
Based on previously reported findings we hypothesized that fear load would be significantly associated with intrusion and fear memories of an index traumatic event.,1
The results indicated that early extinction was correlated with intrusive thoughts (p=0.0007) and intense physiological reactions to trauma reminders (p=0.036).,0
Degree of adult or childhood trauma exposure and depression severity were not associated with fear load.,0
After controlling for age sex race income level of prior trauma and level of fear conditioning fear load during extinction was still significantly predictive of intrusive thoughts (p=0.004).,0
The significance of these findings is that they support dimensional associations with symptom severity rather than diagnostic category and as such fear load may emerge as a transdiagnostic intermediate phenotype expressed across fear-related disorders (e.g. specific phobia social phobia).,0
Development of the hypothalamic-pituitary-adrenal (HPA) axis is influenced by external factors during early life in mammals which optimizes adult function for predicted conditions.,0
We have hypothesized that adolescence represents a sensitive period for the development of some aspects of adult stress response regulation.,0
This was based on prior work showing that repeated exposure of rats to a stressor across an adolescent period increases fearfulness in a novel environment in adulthood and results in lower levels of dopamine receptor subtype-2 protein in prefrontal cortex.,1
Here we further our investigation of both acute and long-term effects of repeated adolescent stressor exposure on physiological (i.e. corticosterone) and behavioral (i.e. defensive behavior) measures of stress responding in male and female rats.,1
Furthermore we compared outcomes with those following identical manipulations administered in early adulthood and found that animals exposed to cues of predation threat during adolescence showed the most robust defensive responses to a homotypic stressor encountered in adulthood.,1
Peer interaction during control manipulation in adolescence was identified as an important individual characteristic mediating development of adult defensive strategies.,0
AIMS: This study was primarily aimed for developing and testing a valid and reliable instrument that measures perceived threat of the risk for graft rejection after organ transplantation.,0
A second aim was to report descriptive data regarding graft rejection and Health-Related Quality of Life.,0
BACKGROUND: The most serious risk connected with transplantations besides infection is graft rejection.,0
DESIGN: Non experimental descriptive involving instrument development and psychometric assessment.,0
METHOD: Questionnaires about perceived threat of the risk for graft rejection and Health-Related Quality of Life were mailed to 229 OTRs between 19-65 years old.,1
The items were formed from a previous interview study.,0
Patients were transplanted with a kidney a liver or a heart and/or a lung.,0
All patients with follow-up time of one year +/- three months and three years +/- three months were included.,0
RESULTS: With an 81% response rate the study comprised of 185 OTRs who had received either a kidney (n = 117) a liver (n = 39) or heart or lung (n = 29).,0
Three homogenous factors of perceived threat for graft rejection were revealed labelled 'intrusive anxiety' 'graft-related threat' and 'lack of control'.,1
Tests of internal consistency showed good item-scale convergent and discriminatory validity.,0
A majority of the OTRs scored low levels for 'intrusive anxiety'.,0
The kidney transplant recipients experienced more 'graft-related threat' by acute graft rejection than those transplanted with a liver heart or lung.,0
CONCLUSION: In conclusion this study suggests that it is possible to measure the perceived threat of the risk for graft rejection in three homogenous factors.,0
Relevance to clinical practice.,0
The instrument perceived threat of the risk for graft rejection might be usable to measure the impact of fear of graft rejection to predict needs of pedagogical intervention strategies to reduce fear and to improve Health-Related Quality of Life related to graft rejection.,1
Recent evidence suggests that the steroid hormone testosterone can decrease the functional coupling between orbitofrontal cortex (OFC) and amygdala.,1
Theoretically this decoupling has been linked to a testosterone-driven increase of goal-directed behaviour in case of threat but this has never been studied directly.,1
Therefore we placed twenty-two women in dynamically changing situations of escapable and inescapable threat after a within-subject placebo controlled testosterone administration.,1
Using functional magnetic resonance imaging (fMRI) we provide evidence that testosterone activates the left lateral OFC (LOFC) in preparation of active goal-directed escape and decouples this OFC area from a subcortical threat system including the central-medial amygdala hypothalamus and periaqueductal gray.,0
This LOFC decoupling was specific to threatening situations a point that was further emphasized by an absence of such decoupling in a second experiment focused on resting-state connectivity.,0
These results not only confirm that testosterone administration decouples the LOFC from the subcortical threat system but also show that this is specifically the case in response to acute threat and ultimately leads to an increase in LOFC activity when the participant prepares a goal-directed action to escape.,0
Together these results for the first time provide a detailed understanding of functional brain alterations induced by testosterone under threat conditions and corroborate and extend the view that testosterone prepares the brain for goal-directed action in case of threat.,1
Serotonin reuptake inhibitors may increase symptoms of anxiety immediately following treatment initiation.,0
The present study examined whether acute citalopram increased fear-potentiated startle to predictable and/or unpredictable shocks in healthy subjects.,1
Eighteen healthy subjects each received two treatments placebo and 20 mg citalopram in a crossover design.,0
Participants were exposed to three conditions including one in which predictable aversive shocks were signaled by a cue a second in which unpredictable shocks were anticipated and a third in which no shocks were administered.,1
Changes in aversive states were investigated using acoustic startle stimuli.,1
Citalopram did not affect baseline startle.,0
However the phasic startle potentiation to the threat cue in the predictable condition was robustly increased by acute citalopram.,0
The sustained startle potentiation in the unpredictable conditions was also increased by citalopram but only when the drug was given during the first session.,0
These results indicate that a single dose of citalopram is not anxiogenic in itself but can exacerbate the expression of fear and anxiety.,1
Phan et al.,0
(2008) recently reported that an acute dose of oral THC is associated with a decrease in threat-related amygdala reactivity during a social threat stimulus task.,0
However to date those findings have not been replicated and have not been extended to clinical studies involving smoked rather than oral cannabis.,0
In this study we hypothesized that level of cannabis smoked by participants in our treatment study would be inversely related to the level of threat-related amygdala reactivity.,1
Subjects were recruited from among participants in our double-blind placebo-controlled trial of fluoxetine in comorbid youth with cannabis dependence/major depression.,0
The threat-related amygdala reactivity task used by Hariri et al.,0
(2009) was completed during BOLD fMRI scans at study baseline and then again 12 weeks later at the end of the trial.,1
Data are available from six subjects with pre-and post-treatment fMRI data.,0
During the course of the study five of the six subjects demonstrated a decrease in their level of cannabis use with a mean decrease of 64% and those persons all demonstrated an increase in their level of amygdala reactivity.,0
One subject demonstrated an increase in their level of cannabis use (a 79% increase) during the treatment trial and that person demonstrated a decrease in their level of amygdala reactivity.,0
Thus a higher level of cannabis use was consistently associated with a lower level of amygdala reactivity across all subjects (matched pairs t = 2.70 df = 5 p < 0.05 two-tailed).,1
These findings are consistent with the reports by Phan et al.,0
(2008) and Hariri et al.,0
(2009) suggesting that cannabinoids have an inhibitory effect on threat-related amygdala reactivity.,0
Stress broadly affects the ability to regulate emotions and may contribute to generalization of threat-related behaviors to harmless stimuli.,0
Behavioral generalization also tends to increase over time as memory precision for recent events gives way to more gist-like representations.,0
Thus acute stress coupled with a delay in time from a negative experience may be a strong predictor of the transition from normal to generalized fear expression.,1
Here we investigated the effect of a single-episode acute stressor on generalization of aversive learning when stress is administered either immediately after an aversive learning event or following a delay.,1
In a between-subjects design healthy adult volunteers underwent threat (fear) conditioning using a tone-conditioned stimulus paired with an electric shock to the wrist and another tone not paired with shock.,1
Behavioral generalization was tested to a range of novel tones either on the same day (experiment 1) or 24 h later (experiment 2) and was preceded by either an acute stress induction or a control task.,0
Anticipatory sympathetic arousal [i.e. skin conductance responses (SCRs)] and explicit measures of shock expectancy served as dependent measures.,0
Stress administered shortly after threat conditioning did not affect behavioral generalization.,0
In contrast stress administered following a delay led to heightened arousal and increased generalization of SCRs and explicit measures of shock expectancy.,0
These findings show that acute stress increases generalization of older but not recent threat memories and have clinical relevance to understanding overgeneralization characteristics of anxiety and stress-related disorders.,1
OBJECTIVE: To examine whether exposure to curve versus sharp contours in the built healthcare setting produces systematic and identifiable patterns of amygdala activation and behavioral response in healthy adults.,1
BACKGROUND: Recent studies in cognitive neuroscience suggest that humans prefer objects with a curved contour compared with objects that have pointed features and a sharp-angled contour.,0
An implicit perception of threat represented by sharp objects in humans was hypothesized to explain this bias.,1
METHOD: The study adopted a within-subject experimental design where 36 subjects (representing three age-groups and both sexes) were exposed to a randomized order of 312 real-life images (objects interiors exteriors landscape and a set of control images).,0
Amygdala activation was simultaneously captured using functional magnetic resonance imaging technology.,0
Subjects' preference (like/dislike) data were also collected while in the scanner.,0
Data were collected in 2013.,0
RESULTS: In case of images depicting landscape and healthcare objects brain scans show significant higher amygdala activation associated with sharp contours.,1
However in relation to images depicting hospital interiors and exterior envelops brain scans show significant higher amygdala activation associated with curve contours.,0
These activations pertain to exposure during the precognitive stages of the subjects' perception.,0
CONCLUSION: Hospital forms do have systematic impact on fear response during precognitive stages of human perception.,1
Whether this first impression colors the subsequent experience of an actual patient with real illness or injury is unknown.,0
The NIMH Research Domain Criteria (RDoC) initiative aims to describe key dimensional constructs underlying mental function across multiple units of analysis-from genes to observable behaviors-in order to better understand psychopathology.,0
The acute threat (fear) construct of the RDoC Negative Valence System has been studied extensively from a translational perspective and is highly pertinent to numerous psychiatric conditions including anxiety and trauma-related disorders.,0
We examined genetic contributions to the construct of acute threat at two units of analysis within the RDoC framework: (1) neural circuits and (2) physiology.,1
Specifically we focused on genetic influences on activation patterns of frontolimbic neural circuitry and on startle skin conductance and heart rate responses.,1
Research on the heritability of activation in threat-related frontolimbic neural circuitry is lacking but physiological indicators of acute threat have been found to be moderately heritable (35-50%).,0
Genetic studies of the neural circuitry and physiology of acute threat have almost exclusively relied on the candidate gene method and as in the broader psychiatric genetics literature most findings have failed to replicate.,1
The most robust support has been demonstrated for associations between variation in the serotonin transporter (SLC6A4) and catechol-O-methyltransferase (COMT) genes with threat-related neural activation and physiological responses.,0
However unbiased genome-wide approaches using very large samples are needed for gene discovery and these can be accomplished with collaborative consortium-based research efforts such as those of the Psychiatric Genomics Consortium (PGC) and Enhancing Neuro Imaging Genetics through Meta-Analysis (ENIGMA) Consortium.,0
Patients with generalized social anxiety disorder (GSAD) exhibit heightened activation of the amygdala in response to social cues conveying threat (eg fearful/angry faces).,1
The neuropeptide oxytocin (OXT) decreases anxiety and stress facilitates social encounters and attenuates amygdala reactivity to threatening faces in healthy subjects.,1
The goal of this study was to examine the effects of OXT on fear-related amygdala reactivity in GSAD and matched healthy control (CON) subjects.,1
In a functional magnetic resonance imaging study utilizing a double-blind placebo-controlled within-subjects design we measured amygdala activation to an emotional face matching task of fearful angry and happy faces following acute intranasal administration of OXT (24 IU or 40.32 mug) and placebo in 18 GSAD and 18 CON subjects.,1
Both the CON and GSAD groups activated bilateral amygdala to all emotional faces during placebo with the GSAD group exhibiting hyperactivity specifically to fearful faces in bilateral amygdala compared with the CON group.,0
OXT had no effect on amygdala activity to emotional faces in the CON group but attenuated the heightened amygdala reactivity to fearful faces in the GSAD group such that the hyperactivity observed during the placebo session was no longer evident following OXT (ie normalization).,0
These findings suggest that OXT has a specific effect on fear-related amygdala activity particularly when the amygdala is hyperactive such as in GSAD thereby providing a brain-based mechanism of the impact of OXT in modulating the exaggerated processing of social signals of threat in patients with pathological anxiety.,0
The ability to adaptively regulate responses to the proximity of potential danger is critical to survival and imbalance in this system may contribute to psychopathology.,0
The bed nucleus of the stria terminalis (BNST) is implicated in defensive responding during uncertain threat anticipation whereas the amygdala may drive responding upon more acute danger.,1
This functional dissociation between the BNST and amygdala is however controversial and human evidence scarce.,0
Here we used data from two independent functional magnetic resonance imaging studies [n = 108 males and n = 70 (45 females)] to probe how coordination between the BNST and amygdala may regulate responses during shock anticipation and actual shock confrontation.,1
In a subset of participants from Sample 2 (n = 48) we demonstrate that anticipation and confrontation evoke bradycardic and tachycardic responses respectively.,0
Further we show that in each sample when going from shock anticipation to the moment of shock confrontation neural activity shifted from a region anatomically consistent with the BNST toward the amygdala.,0
Comparisons of functional connectivity during threat processing showed overlapping yet also consistently divergent functional connectivity profiles for the BNST and amygdala.,0
Finally childhood maltreatment levels predicted amygdala but not BNST hyperactivity during shock anticipation.,0
Our results support an evolutionary conserved defensive distance-dependent dynamic balance between BNST and amygdala activity.,0
Shifts in this balance may enable shifts in defensive reactions via the demonstrated differential functional connectivity.,0
Our results indicate that early life stress may tip the neural balance toward acute threat responding and via that route predispose for affective disorder.SIGNIFICANCE STATEMENT Previously proposed differential contributions of the BNST and amygdala to fear and anxiety have been recently debated.,0
Despite the significance of understanding their contributions to defensive reactions there is a paucity of human studies that directly compared these regions on activity and connectivity during threat processing.,1
We show strong evidence for a dissociable role of the BNST and amygdala in threat processing by demonstrating in two large participant samples that they show a distinct temporal signature of threat responding as well as a discriminable pattern of functional connections and differential sensitivity to early life threat.,0
Fear generalization occurs when a response previously acquired with a threatening stimulus is transferred to a similar one.,1
However it could be maladaptive when stimuli that do not represent a real threat are appraised as dangerous which is a hallmark of several anxiety disorders.,0
Stress exposure is a major risk factor for the occurrence of anxiety disorders and it is well established that it influences different phases of fear memory; nevertheless its impact on the generalization of contextual fear memories has been less studied.,0
In the present work we have characterized the impact of acute restraint stress prior to contextual fear conditioning on the generalization of this fear memory and the role of the GABAergic signaling within the basolateral amygdala complex (BLA) on the stress modulatory effects.,1
We have found that a single stress exposure promoted the generalization of this memory trace to a different context that was well discriminated in unstressed conditioned animals.,0
Moreover this effect was dependent on the formation of a contextual associative memory and on the testing order (i.e. conditioning context first vs generalization context first).,0
Furthermore we observed that increasing GABA-A signaling by intra-BLA midazolam administration prior to the stressful session exposure prevented the generalization of fear memory whereas intra-BLA administration of the GABA-A antagonist (Bicuculline) prior to fear conditioning induced the generalization of fear memory in unstressed rats.,1
We concluded that stress exposure prior to contextual fear conditioning promotes the generalization of fear memory and that the GABAergic transmission within the BLA has a critical role in this phenomenon.,1
